{
  "title": "CacheBlend Quality-Only Reproduction on Mistral-7B (HF transformers, from scratch)",
  "strategy": {
    "type": "from_scratch",
    "source_url": "https://github.com/YaoJiayi/CacheBlend",
    "justification": "The official YaoJiayi/CacheBlend repo is a vendored vLLM 0.4.x fork pinned to PyTorch 2.0 and CUDA 12.1 with heavy custom CUDA kernels; it is impractical to install and modify for a small quality-only reproduction. The user has narrowed scope to F1 / Rouge-L on Mistral-7B fp16 against three strategies (selective recompute, full recompute, full reuse), with TTFT/throughput explicitly out of scope, which removes the only reason to depend on vLLM. Building a thin HuggingFace transformers wrapper that (a) caches per-chunk per-layer K/V in CPU tensors, (b) overrides the Mistral attention forward to apply RoPE re-rotation and selective recompute at a single check layer, and (c) drives layer-by-layer fusion via a custom forward pass, is dramatically more tractable. The official code remains a reference for exact algorithmic details (RoPE recovery, V-deviation top-r%, single check layer at index 1, in-place index assignment), which are pinned in the ambiguity log."
  },
  "stack": {
    "language": "Python 3.10",
    "framework": "PyTorch 2.2+ with HuggingFace transformers 4.40+",
    "key_libs": [
      "torch>=2.2",
      "transformers>=4.40,<4.46",
      "accelerate",
      "datasets",
      "rouge_score>=0.1.2",
      "numpy",
      "tqdm",
      "pyyaml",
      "pytest"
    ]
  },
  "modules": [
    {
      "path": "code/cacheblend/kv_cache.py",
      "purpose": "In-memory per-(chunk_hash, layer_id) KV cache store with sha256_cbor hashing, fetch/put API, and pre-RoPE storage convention.",
      "implements": [
        "KVCacheStore"
      ],
      "public_api": [
        "class ChunkKVStore:",
        "  def __init__(self, num_layers: int, dtype: torch.dtype, device: str = 'cpu')",
        "  def hash_chunk(self, token_ids: list[int], parent_hash: bytes | None = None) -> bytes",
        "  def put(self, chunk_hash: bytes, layer_id: int, k: torch.Tensor, v: torch.Tensor) -> None",
        "  def fetch(self, chunk_hash: bytes, layer_id: int) -> tuple[torch.Tensor, torch.Tensor] | None",
        "  def has(self, chunk_hash: bytes) -> bool"
      ]
    },
    {
      "path": "code/cacheblend/blend.py",
      "purpose": "RoPE re-rotation helper that re-applies Mistral's rotary embedding to a stored (un-rotated) K tensor at new absolute positions; mirrors the rotary_emb(new_positions, fake_q, K_pre) call in vllm_blend/llama.py:174-179.",
      "implements": [
        "PositionalEncodingRecovery"
      ],
      "public_api": [
        "def recover_rope_k(k_pre: torch.Tensor, new_positions: torch.LongTensor, rotary_emb: Callable) -> torch.Tensor",
        "def concat_chunk_kvs(per_chunk_kv: list[tuple[Tensor, Tensor]], new_positions: torch.LongTensor, rotary_emb) -> tuple[Tensor, Tensor]"
      ]
    },
    {
      "path": "code/cacheblend/selective_recompute.py",
      "purpose": "Core CacheBlend algorithm: layer-by-layer prefill that recomputes Q/K/V only for HKVD-selected tokens, computes V-deviation at the single check layer (idx 1), picks top-r% indices, and reuses them on later layers. Performs in-place index assignment of K/V into the loaded tensors, then runs standard full-sequence attention.",
      "implements": [
        "SelectiveKVRecompute",
        "HKVDSelector",
        "Fusor"
      ],
      "public_api": [
        "@dataclass class BlendConfig: recompute_ratio: float; check_layer: int = 1; schedule: str = 'single_check'",
        "class CacheBlendMistral(MistralForCausalLM):",
        "  def blend_forward(self, input_ids, chunk_boundaries, per_layer_pre_kv, cfg: BlendConfig) -> tuple[Tensor, list[tuple[Tensor, Tensor]]]",
        "def compute_v_deviation(v_new: Tensor, v_pre: Tensor) -> Tensor",
        "def select_hkvd_indices(deviation: Tensor, r: float) -> torch.LongTensor",
        "def selective_layer_forward(layer, hidden_states, position_ids, pre_kv_layer, hkvd_idx, status: int, rotary_emb) -> tuple[Tensor, Tensor, Tensor, torch.LongTensor]"
      ]
    },
    {
      "path": "code/cacheblend/baselines.py",
      "purpose": "Implements the two non-CacheBlend strategies: (1) full prefill recompute via the unmodified HF Mistral forward, and (2) full KV reuse (PromptCache-style) which concatenates pre-computed per-chunk KV with RoPE recovery applied, but with NO recompute at any layer.",
      "implements": [
        "SelectiveKVRecompute",
        "PositionalEncodingRecovery"
      ],
      "public_api": [
        "def full_recompute_generate(model, tokenizer, prompt: str, max_new_tokens: int) -> str",
        "def full_reuse_generate(model, tokenizer, chunks: list[str], query: str, store: ChunkKVStore, max_new_tokens: int) -> str",
        "def cacheblend_generate(model, tokenizer, chunks: list[str], query: str, store: ChunkKVStore, cfg: BlendConfig, max_new_tokens: int) -> str"
      ]
    },
    {
      "path": "code/cacheblend/precompute.py",
      "purpose": "Offline (warm-up) pass that runs the Mistral model on each chunk in isolation and stores its per-layer K (pre-RoPE) and V into ChunkKVStore. This populates the cache that all three strategies will draw from.",
      "implements": [
        "KVCacheStore"
      ],
      "public_api": [
        "def precompute_chunk_kv(model, tokenizer, chunk_text: str, store: ChunkKVStore) -> bytes",
        "def precompute_all_chunks(model, tokenizer, chunks: Iterable[str], store: ChunkKVStore) -> list[bytes]"
      ]
    },
    {
      "path": "code/eval/datasets.py",
      "purpose": "Loads 2WikiMQA, Musique, SAMSum, MultiNews from the pinned wikimqa_s.json / musique_s.json / samsum.json bundled in the official CacheBlend repo (or HuggingFace fallbacks), chunks contexts (Langchain-style 512-token chunker; SAMSum native), and applies the exact prompt templates from example/utils.py (build_qa_prompt, build_fewshot_prompt).",
      "implements": [
        "KVCacheStore"
      ],
      "public_api": [
        "def load_wikimqa(path: str, n: int | None) -> list[Example]",
        "def load_musique(path: str, n: int | None) -> list[Example]",
        "def load_samsum(path: str, n: int | None) -> list[Example]",
        "def load_multinews(n: int | None) -> list[Example]",
        "def chunk_text(text: str, tokenizer, chunk_size_tokens: int = 512) -> list[str]",
        "def build_qa_prompt(question: str, contexts: list[dict]) -> tuple[str, list[str]]  # returns (full_prompt, per_chunk_strings)"
      ]
    },
    {
      "path": "code/eval/metrics.py",
      "purpose": "SQuAD-style token-id F1 (using LLM tokenizer, dropping BOS) for 2WikiMQA / Musique and rouge_score Rouge-L (use_stemmer=True) f-measure for SAMSum / MultiNews, matching example/utils.py compute_f1 / compute_rl.",
      "implements": [
        "KVCacheStore"
      ],
      "public_api": [
        "def normalize_answer(text: str) -> str",
        "def compute_f1(pred: str, gold: str, tokenizer) -> float",
        "def compute_f1_max(pred: str, golds: list[str], tokenizer) -> float",
        "def compute_rouge_l(pred: str, gold: str) -> float"
      ]
    },
    {
      "path": "code/eval/run_eval.py",
      "purpose": "Top-level eval driver: for each (dataset, strategy, recompute_ratio) combination, iterates examples, calls the appropriate generator (cacheblend_generate / full_recompute_generate / full_reuse_generate), records predictions, computes metrics, writes results to workspace/results/<run_id>.json.",
      "implements": [
        "Fusor",
        "LoadingController"
      ],
      "public_api": [
        "def run_eval(config_path: str) -> dict",
        "def main() -> None  # CLI entry: --config configs/default.yaml"
      ]
    },
    {
      "path": "code/scripts/run_smoke.py",
      "purpose": "Five-example end-to-end smoke test on 2WikiMQA at r=0.15, producing one tiny F1 number per strategy; used as fast CI sanity check before launching the full eval grid.",
      "implements": [
        "Fusor"
      ],
      "public_api": [
        "def main() -> None  # prints F1_full / F1_cacheblend / F1_reuse on 5 examples"
      ]
    },
    {
      "path": "code/configs/default.yaml",
      "purpose": "Single source of truth for run parameters: model id, dtype, dataset subset sizes, recompute_ratio grid, check_layer index, num_chunks per query, max_new_tokens, output dir.",
      "implements": [
        "LoadingController"
      ],
      "public_api": [
        "# YAML keys: model.name, model.dtype, datasets.*.n, strategy.recompute_ratios, strategy.check_layer, strategy.num_chunks, generation.max_new_tokens, output.results_dir"
      ]
    },
    {
      "path": "code/tests/test_kv_cache.py",
      "purpose": "Unit tests for ChunkKVStore: hash determinism, put/fetch round-trip, miss returns None, dtype preserved.",
      "implements": [
        "KVCacheStore"
      ],
      "public_api": [
        "def test_hash_is_deterministic()",
        "def test_put_fetch_roundtrip()",
        "def test_miss_returns_none()"
      ]
    },
    {
      "path": "code/tests/test_rope_recovery.py",
      "purpose": "Unit tests for PositionalEncodingRecovery: applying RoPE at new positions to stored (un-rotated) K must equal a direct Mistral forward pass at those positions (tolerance 1e-4).",
      "implements": [
        "PositionalEncodingRecovery"
      ],
      "public_api": [
        "def test_rope_recovery_matches_direct_forward()",
        "def test_rope_recovery_shape_preserved()"
      ]
    },
    {
      "path": "code/tests/test_hkvd_selector.py",
      "purpose": "Unit tests for V-deviation and top-r% selection: synthetic V_new / V_pre with known per-token squared L2 norms produces the expected top-k indices; r% rounds via ceil.",
      "implements": [
        "HKVDSelector"
      ],
      "public_api": [
        "def test_v_deviation_is_per_token_squared_l2()",